{
  "case_id": "c2a-v0.1-rcpt-031-receipt-link-not-object-reference-001",
  "protocol_version": "0.1",
  "requirement_ids": [
    "RCPT-031"
  ],
  "planned_test_ids": [
    "receipt-link-not-object-reference-001"
  ],
  "primary_enforcement": "semantic_verifier",
  "status": "executable",
  "description": "ReceiptLink records package linkage and is not an object-level provenance reference.",
  "documents": [
    {
      "document_id": "b",
      "role": "primary_receipt",
      "source": {
        "path": "fixtures/v0.1/valid/multi-receipt-b.json"
      },
      "schema_target": "urn:c2atrace:schema:v0.1:receipt#/$defs/ReceiptPresentation"
    }
  ],
  "execution": {
    "phases": [
      "schema_validate",
      "resolve_references",
      "graph_checks",
      "claim_checks",
      "aggregate_report"
    ],
    "resolution_set": [],
    "verifier_goals": [
      "RCPT-031"
    ]
  },
  "harness": {
    "verification_invocation_id": "ci-rcpt-031",
    "primary_documents": [
      "b"
    ],
    "resolution_set": [],
    "supported_profiles": [
      "urn:c2atrace:profile:v0.1:core"
    ],
    "goals": [
      "RCPT-031"
    ]
  },
  "notes": [
    "primitives: prim.receipt.multi, prim.ref.external"
  ],
  "expected_result": "conformance/v0.1/expected/semantic/c2a-v0.1-rcpt-031-receipt-link-not-object-reference-001.json"
}
