{
  "case_id": "c2a-v0.1-taint-023-taint-mixed-channel-001",
  "protocol_version": "0.1",
  "requirement_ids": [
    "TAINT-023"
  ],
  "planned_test_ids": [
    "taint-mixed-channel-001"
  ],
  "primary_enforcement": "semantic_verifier",
  "status": "executable",
  "description": "channel=mixed is supported only when both content and control premises are positively represented.",
  "documents": [
    {
      "document_id": "primary",
      "role": "primary_receipt",
      "source": {
        "path": "conformance/v0.1/primitives/receipts/taint-mixed-channel.json"
      },
      "schema_target": "urn:c2atrace:schema:v0.1:receipt#/$defs/ReceiptPresentation"
    }
  ],
  "execution": {
    "phases": [
      "schema_validate",
      "resolve_references",
      "graph_checks",
      "representation_checks",
      "integrity_checks",
      "claim_checks",
      "aggregate_report"
    ],
    "resolution_set": [],
    "capabilities": [],
    "verifier_goals": [
      "TAINT-023"
    ]
  },
  "harness": {
    "verification_invocation_id": "ci-taint-023",
    "primary_documents": [
      "primary"
    ],
    "resolution_set": [],
    "supported_profiles": [
      "urn:c2atrace:profile:v0.1:core"
    ],
    "goals": [
      "TAINT-023"
    ]
  },
  "notes": [
    "primitives: prim.taint.flow"
  ],
  "expected_result": "conformance/v0.1/expected/semantic/c2a-v0.1-taint-023-taint-mixed-channel-001.json"
}
