{
  "case_id": "c2a-v0.1-tool-008-tool-proposal-invocation-lineage-001",
  "protocol_version": "0.1",
  "requirement_ids": [
    "TOOL-008"
  ],
  "planned_test_ids": [
    "tool-proposal-invocation-lineage-001"
  ],
  "primary_enforcement": "mixed_schema_semantic",
  "status": "executable",
  "description": "The baseline tool fixture records explicit proposal-to-invocation lineage through prep-001 Transform and the ToolInvocation preparation_transform reference.",
  "documents": [
    {
      "document_id": "semantic-receipt",
      "role": "primary_receipt",
      "source": {
        "path": "fixtures/v0.1/valid/tool-effect.json"
      },
      "schema_target": "urn:c2atrace:schema:v0.1:receipt#/$defs/ReceiptPresentation"
    }
  ],
  "execution": {
    "phases": [
      "schema_validate",
      "resolve_references",
      "graph_checks",
      "aggregate_report"
    ],
    "resolution_set": [
      "semantic-receipt"
    ],
    "verifier_goals": [
      "TOOL-008"
    ]
  },
  "harness": {
    "verification_invocation_id": "ci-tool-008",
    "primary_documents": [
      "semantic-receipt"
    ],
    "resolution_set": [
      "semantic-receipt"
    ],
    "supported_profiles": [
      "urn:c2atrace:profile:v0.1:core"
    ],
    "goals": [
      "TOOL-008"
    ]
  },
  "expected_result": "conformance/v0.1/expected/mixed/c2a-v0.1-tool-008-tool-proposal-invocation-lineage-001.json"
}
