{
  "case_id": "c2a-v0.1-vfy-038-verifier-binding-whole-commitment-001",
  "protocol_version": "0.1",
  "requirement_ids": [
    "VFY-038"
  ],
  "planned_test_ids": [
    "verifier-binding-whole-commitment-001"
  ],
  "primary_enforcement": "semantic_verifier",
  "status": "executable",
  "description": "Whole-request commitment evidence does not prove membership at a hidden sublocation.",
  "documents": [
    {
      "document_id": "primary",
      "role": "primary_receipt",
      "source": {
        "path": "conformance/v0.1/primitives/receipts/request-commitment-whole.json"
      },
      "schema_target": "urn:c2atrace:schema:v0.1:receipt#/$defs/ReceiptPresentation"
    }
  ],
  "execution": {
    "phases": [
      "schema_validate",
      "resolve_references",
      "representation_checks",
      "privacy_checks",
      "claim_checks",
      "aggregate_report"
    ],
    "resolution_set": [],
    "verifier_goals": [
      "VFY-038"
    ]
  },
  "harness": {
    "verification_invocation_id": "ci-vfy-038",
    "primary_documents": [
      "primary"
    ],
    "resolution_set": [],
    "supported_profiles": [
      "urn:c2atrace:profile:v0.1:core"
    ],
    "goals": [
      "VFY-038"
    ]
  },
  "notes": [
    "primitives: prim.verifier.report"
  ],
  "expected_result": "conformance/v0.1/expected/semantic/c2a-v0.1-vfy-038-verifier-binding-whole-commitment-001.json"
}
