{
  "case_id": "c2a-v0.1-pad-055-provider-retry-relation-positive-001",
  "protocol_version": "0.1",
  "requirement_ids": [
    "PAD-055"
  ],
  "planned_test_ids": [
    "provider-retry-relation-positive-001"
  ],
  "primary_enforcement": "semantic_verifier",
  "status": "executable",
  "description": "retry_of is accompanied by explicit application-orchestrator evidence rather than inferred from similarity, timestamps, or provider metadata alone.",
  "documents": [
    {
      "document_id": "primary",
      "role": "primary_receipt",
      "source": {
        "path": "conformance/v0.1/primitives/receipts/provider-visible-retry.json"
      },
      "schema_target": "urn:c2atrace:schema:v0.1:receipt#/$defs/ReceiptPresentation"
    }
  ],
  "execution": {
    "phases": [
      "schema_validate",
      "resolve_references",
      "graph_checks",
      "claim_checks",
      "aggregate_report"
    ],
    "resolution_set": [],
    "verifier_goals": [
      "PAD-055"
    ]
  },
  "harness": {
    "verification_invocation_id": "ci-pad-055",
    "primary_documents": [
      "primary"
    ],
    "resolution_set": [],
    "supported_profiles": [
      "urn:c2atrace:profile:v0.1:core"
    ],
    "goals": [
      "PAD-055"
    ]
  },
  "notes": [
    "primitives: prim.provider.attempts"
  ],
  "expected_result": "conformance/v0.1/expected/semantic/c2a-v0.1-pad-055-provider-retry-relation-positive-001.json"
}
