{
  "case_id": "c2a-v0.1-vfy-043-verifier-hmac-secret-nondisclosure-001",
  "protocol_version": "0.1",
  "requirement_ids": [
    "VFY-043"
  ],
  "planned_test_ids": [
    "verifier-hmac-secret-nondisclosure-001"
  ],
  "primary_enforcement": "semantic_verifier",
  "status": "executable",
  "description": "A supplied HMAC secret capability can support verification without becoming ordinary VerificationReport content.",
  "documents": [
    {
      "document_id": "primary",
      "role": "primary_receipt",
      "source": {
        "path": "fixtures/v0.1/valid/privacy-hmac.json"
      },
      "schema_target": "urn:c2atrace:schema:v0.1:receipt#/$defs/ReceiptPresentation"
    }
  ],
  "execution": {
    "phases": [
      "schema_validate",
      "representation_checks",
      "privacy_checks",
      "claim_checks",
      "aggregate_report"
    ],
    "resolution_set": [],
    "verifier_goals": [
      "VFY-043"
    ],
    "capabilities": [
      "hmac_capabilities"
    ]
  },
  "harness": {
    "verification_invocation_id": "ci-vfy-043",
    "primary_documents": [
      "primary"
    ],
    "resolution_set": [],
    "supported_profiles": [
      "urn:c2atrace:profile:v0.1:core",
      "urn:c2atrace:profile:v0.1:privacy:core"
    ],
    "goals": [
      "VFY-043"
    ],
    "hmac_capabilities": [
      {
        "key_ref": "test-hmac-key-001",
        "method": "hmac-sha256",
        "secret_hex": "000102030405060708090a0b0c0d0e0f101112131415161718191a1b1c1d1e1f"
      }
    ]
  },
  "notes": [
    "primitives: prim.verifier.report"
  ],
  "expected_result": "conformance/v0.1/expected/semantic/c2a-v0.1-vfy-043-verifier-hmac-secret-nondisclosure-001.json"
}
