{
  "case_id": "c2a-v0.1-trust-023-trust-unknown-authority-wording-001",
  "protocol_version": "0.1",
  "requirement_ids": [
    "TRUST-023"
  ],
  "planned_test_ids": [
    "trust-unknown-authority-wording-001"
  ],
  "primary_enforcement": "semantic_verifier",
  "status": "executable",
  "description": "Unknown issuer and policy limit the assertion to an unidentified authority judgement.",
  "documents": [
    {
      "document_id": "primary",
      "role": "primary_receipt",
      "source": {
        "path": "conformance/v0.1/primitives/receipts/trust-unknown.json"
      },
      "schema_target": "urn:c2atrace:schema:v0.1:receipt#/$defs/ReceiptPresentation"
    }
  ],
  "execution": {
    "phases": [
      "schema_validate",
      "resolve_references",
      "graph_checks",
      "claim_checks",
      "aggregate_report"
    ],
    "resolution_set": [],
    "capabilities": [],
    "verifier_goals": [
      "TRUST-023"
    ]
  },
  "harness": {
    "verification_invocation_id": "ci-trust-023",
    "primary_documents": [
      "primary"
    ],
    "resolution_set": [],
    "supported_profiles": [
      "urn:c2atrace:profile:v0.1:core"
    ],
    "goals": [
      "TRUST-023"
    ]
  },
  "notes": [
    "primitives: prim.trust.assertion, prim.claim.strength"
  ],
  "expected_result": "conformance/v0.1/expected/semantic/c2a-v0.1-trust-023-trust-unknown-authority-wording-001.json"
}
