{
  "case_id": "c2a-v0.1-trust-007-trust-policy-context-001",
  "protocol_version": "0.1",
  "requirement_ids": [
    "TRUST-007"
  ],
  "planned_test_ids": [
    "trust-policy-context-001"
  ],
  "primary_enforcement": "mixed_schema_semantic",
  "status": "executable",
  "description": "TrustAssertion requires policy context; explicit unknown is a valid bounded policy state.",
  "documents": [
    {
      "document_id": "trust-missing-policy",
      "role": "raw_object",
      "source": {
        "inline": {
          "id": "trust-raw-001",
          "kind": "TrustAssertion",
          "subject": {
            "ref": {
              "ref_type": "local",
              "id": "frag-001",
              "expected_kind": "ContextFragment"
            }
          },
          "dimension": "source_reliability",
          "state": "trusted",
          "asserted_by": {
            "state": "unknown"
          }
        }
      },
      "schema_target": "urn:c2atrace:schema:v0.1:trust-taint#/$defs/TrustAssertion"
    },
    {
      "document_id": "semantic-receipt",
      "role": "primary_receipt",
      "source": {
        "path": "fixtures/v0.1/valid/source-to-request.json"
      },
      "schema_target": "urn:c2atrace:schema:v0.1:receipt#/$defs/ReceiptPresentation",
      "patches": [
        {
          "op": "add",
          "path": "/arp/records/-",
          "value": {
            "id": "trust-policy-001",
            "kind": "TrustAssertion",
            "run_id": "run-sr-001",
            "subject": {
              "ref": {
                "ref_type": "local",
                "id": "frag-001",
                "expected_kind": "ContextFragment"
              }
            },
            "dimension": "source_reliability",
            "state": "trusted",
            "asserted_by": {
              "state": "unknown"
            },
            "policy": {
              "state": "unknown"
            }
          }
        },
        {
          "op": "add",
          "path": "/arp/inventory/-",
          "value": "trust-policy-001"
        }
      ]
    }
  ],
  "execution": {
    "phases": [
      "schema_validate",
      "resolve_references",
      "claim_checks",
      "aggregate_report"
    ],
    "resolution_set": [
      "semantic-receipt"
    ],
    "verifier_goals": [
      "TRUST-007"
    ]
  },
  "harness": {
    "verification_invocation_id": "ci-trust-007",
    "primary_documents": [
      "semantic-receipt"
    ],
    "resolution_set": [
      "semantic-receipt"
    ],
    "supported_profiles": [
      "urn:c2atrace:profile:v0.1:core"
    ],
    "goals": [
      "TRUST-007"
    ]
  },
  "expected_result": "conformance/v0.1/expected/mixed/c2a-v0.1-trust-007-trust-policy-context-001.json"
}
