{
  "case_id": "c2a-v0.1-intg-060-integrity-no-fully-verified-shorthand-001",
  "protocol_version": "0.1",
  "requirement_ids": [
    "INTG-060"
  ],
  "planned_test_ids": [
    "integrity-no-fully-verified-shorthand-001"
  ],
  "primary_enforcement": "semantic_verifier",
  "status": "executable",
  "description": "A verifier keeps unresolved claim/completeness dimensions explicit instead of emitting an unqualified fully-verified verdict.",
  "documents": [
    {
      "document_id": "primary",
      "role": "primary_receipt",
      "source": {
        "path": "fixtures/v0.1/valid/minimal-signed-receipt.json"
      },
      "schema_target": "urn:c2atrace:schema:v0.1:receipt#/$defs/ReceiptPresentation"
    }
  ],
  "execution": {
    "phases": [
      "schema_validate",
      "resolve_references",
      "integrity_checks",
      "claim_checks",
      "aggregate_report"
    ],
    "resolution_set": [],
    "capabilities": [
      "verification_keys"
    ],
    "verifier_goals": [
      "INTG-060"
    ]
  },
  "harness": {
    "verification_invocation_id": "ci-intg-060",
    "primary_documents": [
      "primary"
    ],
    "resolution_set": [],
    "supported_profiles": [
      "urn:c2atrace:profile:v0.1:core",
      "urn:c2atrace:profile:v0.1:integrity:jcs-sha256-ed25519"
    ],
    "goals": [
      "INTG-060"
    ],
    "verification_keys": [
      "test-ed25519-key-001"
    ]
  },
  "notes": [
    "primitives: prim.integrity.composition"
  ],
  "expected_result": "conformance/v0.1/expected/semantic/c2a-v0.1-intg-060-integrity-no-fully-verified-shorthand-001.json"
}
