{
  "case_id": "c2a-v0.1-tad-009-tool-capture-diagnostic-scope-001",
  "protocol_version": "0.1",
  "requirement_ids": [
    "TAD-009"
  ],
  "planned_test_ids": [
    "tool-capture-diagnostic-scope-001"
  ],
  "primary_enforcement": "mixed_schema_semantic",
  "status": "executable",
  "description": "CaptureDiagnostic requires an explicit slot locally; a syntactically bounded subject that does not resolve is not a valid bounded capture scope.",
  "documents": [
    {
      "document_id": "diagnostic-valid",
      "role": "raw_object",
      "source": {
        "inline": {
          "id": "diag-tool-001",
          "kind": "CaptureDiagnostic",
          "subject": {
            "ref": {
              "ref_type": "local",
              "id": "invoke-001",
              "expected_kind": "ToolInvocation"
            }
          },
          "slot": "tool_invocation.arguments",
          "status": "observed"
        }
      },
      "schema_target": "urn:c2atrace:schema:v0.1:adapter#/$defs/CaptureDiagnostic"
    },
    {
      "document_id": "diagnostic-missing-slot-invalid",
      "role": "raw_object",
      "source": {
        "inline": {
          "id": "diag-tool-001",
          "kind": "CaptureDiagnostic",
          "subject": {
            "ref": {
              "ref_type": "local",
              "id": "invoke-001",
              "expected_kind": "ToolInvocation"
            }
          },
          "status": "observed"
        }
      },
      "schema_target": "urn:c2atrace:schema:v0.1:adapter#/$defs/CaptureDiagnostic"
    },
    {
      "document_id": "semantic-receipt",
      "role": "primary_receipt",
      "source": {
        "path": "fixtures/v0.1/valid/tool-effect.json"
      },
      "patches": [
        {
          "op": "add",
          "path": "/arp/records/-",
          "value": {
            "id": "diag-tool-missing-001",
            "kind": "CaptureDiagnostic",
            "run_id": "run-tool-001",
            "subject": {
              "ref": {
                "ref_type": "local",
                "id": "missing-invocation",
                "expected_kind": "ToolInvocation"
              }
            },
            "slot": "tool_invocation.arguments",
            "status": "unavailable",
            "reason": "instrumentation target was not captured"
          }
        },
        {
          "op": "add",
          "path": "/arp/inventory/-",
          "value": "diag-tool-missing-001"
        }
      ],
      "schema_target": "urn:c2atrace:schema:v0.1:receipt#/$defs/ReceiptPresentation"
    }
  ],
  "execution": {
    "phases": [
      "schema_validate",
      "resolve_references",
      "claim_checks",
      "aggregate_report"
    ],
    "resolution_set": [
      "semantic-receipt"
    ],
    "verifier_goals": [
      "TAD-009"
    ]
  },
  "harness": {
    "verification_invocation_id": "ci-tad-009",
    "primary_documents": [
      "semantic-receipt"
    ],
    "resolution_set": [
      "semantic-receipt"
    ],
    "supported_profiles": [
      "urn:c2atrace:profile:v0.1:adapter:tool"
    ],
    "goals": [
      "TAD-009"
    ]
  },
  "expected_result": "conformance/v0.1/expected/mixed/c2a-v0.1-tad-009-tool-capture-diagnostic-scope-001.json"
}
