{
  "case_id": "c2a-v0.1-tm-008-tool-success-no-effect-001",
  "protocol_version": "0.1",
  "requirement_ids": [
    "TM-008"
  ],
  "planned_test_ids": [
    "tool-success-no-effect-001"
  ],
  "primary_enforcement": "semantic_verifier",
  "status": "executable",
  "description": "Completed ToolExecution is not external effect truth.",
  "documents": [
    {
      "document_id": "primary",
      "role": "primary_receipt",
      "source": {
        "path": "conformance/v0.1/primitives/receipts/tool-completed-no-effect.json"
      },
      "schema_target": "urn:c2atrace:schema:v0.1:receipt#/$defs/ReceiptPresentation"
    }
  ],
  "execution": {
    "phases": [
      "schema_validate",
      "resolve_references",
      "graph_checks",
      "claim_checks",
      "aggregate_report"
    ],
    "resolution_set": [],
    "verifier_goals": [
      "TM-008"
    ]
  },
  "harness": {
    "verification_invocation_id": "ci-tm-008",
    "primary_documents": [
      "primary"
    ],
    "resolution_set": [],
    "supported_profiles": [
      "urn:c2atrace:profile:v0.1:core"
    ],
    "goals": [
      "TM-008"
    ]
  },
  "notes": [
    "primitives: prim.claim.strength, prim.tool.lifecycle"
  ],
  "expected_result": "conformance/v0.1/expected/semantic/c2a-v0.1-tm-008-tool-success-no-effect-001.json"
}
