{
  "case_id": "c2a-v0.1-vfy-025-verifier-external-unresolved-001",
  "protocol_version": "0.1",
  "requirement_ids": [
    "VFY-025"
  ],
  "planned_test_ids": [
    "verifier-external-unresolved-001"
  ],
  "primary_enforcement": "semantic_verifier",
  "status": "executable",
  "description": "An unavailable external target remains unresolved; the verifier does not invent or fetch it implicitly.",
  "documents": [
    {
      "document_id": "primary",
      "role": "primary_receipt",
      "source": {
        "path": "conformance/v0.1/primitives/receipts/ref-external-unpinned.json"
      },
      "schema_target": "urn:c2atrace:schema:v0.1:receipt#/$defs/ReceiptPresentation"
    }
  ],
  "execution": {
    "phases": [
      "schema_validate",
      "resolve_references",
      "graph_checks",
      "claim_checks",
      "aggregate_report"
    ],
    "resolution_set": [],
    "verifier_goals": [
      "VFY-025"
    ]
  },
  "harness": {
    "verification_invocation_id": "ci-vfy-025",
    "primary_documents": [
      "primary"
    ],
    "resolution_set": [],
    "supported_profiles": [
      "urn:c2atrace:profile:v0.1:core"
    ],
    "goals": [
      "VFY-025"
    ]
  },
  "notes": [
    "primitives: prim.verifier.report, prim.ref.external, prim.ref.failure"
  ],
  "expected_result": "conformance/v0.1/expected/semantic/c2a-v0.1-vfy-025-verifier-external-unresolved-001.json"
}
