{
  "case_id": "c2a-v0.1-out-026-model-output-no-content-merge-001",
  "protocol_version": "0.1",
  "requirement_ids": [
    "OUT-026"
  ],
  "planned_test_ids": [
    "model-output-no-content-merge-001"
  ],
  "primary_enforcement": "semantic_verifier",
  "status": "executable",
  "description": "Distinct ModelOutput occurrences remain distinct when visible text content is equal.",
  "documents": [
    {
      "document_id": "primary",
      "role": "primary_receipt",
      "source": {
        "path": "conformance/v0.1/primitives/receipts/identity-model-outputs.json"
      },
      "schema_target": "urn:c2atrace:schema:v0.1:receipt#/$defs/ReceiptPresentation"
    }
  ],
  "execution": {
    "phases": [
      "schema_validate",
      "resolve_references",
      "graph_checks",
      "representation_checks",
      "privacy_checks",
      "integrity_checks",
      "claim_checks",
      "aggregate_report"
    ],
    "resolution_set": [],
    "capabilities": [],
    "verifier_goals": [
      "OUT-026"
    ]
  },
  "harness": {
    "verification_invocation_id": "ci-out-026",
    "primary_documents": [
      "primary"
    ],
    "resolution_set": [],
    "supported_profiles": [
      "urn:c2atrace:profile:v0.1:core"
    ],
    "goals": [
      "OUT-026"
    ]
  },
  "notes": [
    "primitives: prim.identity.occurrence"
  ],
  "expected_result": "conformance/v0.1/expected/semantic/c2a-v0.1-out-026-model-output-no-content-merge-001.json"
}
